{
  "$schema": "https://json-schema.org/draft/2020-12/schema",
  "$id": "https://premium-web-dna.local/schemas/ai-rules.schema.json",
  "title": "Premium Web DNA AI Rules",
  "type": "object",
  "required": [
    "schema_version",
    "framework",
    "framework_version",
    "source",
    "archetype",
    "fingerprint",
    "global",
    "tokens",
    "hero",
    "components",
    "pages",
    "rules"
  ],
  "properties": {
    "$schema": {
      "type": "string"
    },
    "schema_version": {
      "type": "string"
    },
    "framework": {
      "type": "string",
      "const": "DNA Audit Framework v1"
    },
    "framework_version": {
      "type": "string"
    },
    "source": {
      "type": "object",
      "required": [
        "name",
        "slug",
        "version"
      ],
      "properties": {
        "name": {
          "type": "string"
        },
        "slug": {
          "type": "string"
        },
        "version": {
          "type": "string"
        }
      }
    },
    "archetype": {
      "type": "string"
    },
    "fingerprint": {
      "type": "object"
    },
    "global": {
      "type": "object",
      "required": [
        "max_font_families",
        "accent_budget_per_viewport",
        "corner_radius",
        "motion_easing",
        "forbidden"
      ],
      "properties": {
        "max_font_families": {
          "type": "integer",
          "minimum": 1
        },
        "accent_budget_per_viewport": {
          "type": "integer",
          "minimum": 0
        },
        "corner_radius": {
          "type": "string"
        },
        "motion_easing": {
          "type": "string"
        },
        "forbidden": {
          "type": "array",
          "items": {
            "type": "string"
          }
        }
      }
    },
    "tokens": {
      "type": "object"
    },
    "hero": {
      "type": "object",
      "required": [
        "preferred_variant",
        "headline_length",
        "cta_count"
      ],
      "properties": {
        "preferred_variant": {
          "type": "string"
        },
        "headline_length": {
          "type": "string"
        },
        "cta_count": {
          "type": "integer",
          "minimum": 0
        }
      }
    },
    "components": {
      "type": "array",
      "items": {
        "type": "object",
        "required": [
          "id",
          "component",
          "variant",
          "confidence"
        ]
      }
    },
    "pages": {
      "type": "array",
      "items": {
        "type": "object"
      }
    },
    "rules": {
      "type": "object",
      "required": [
        "do",
        "dont"
      ]
    }
  }
}
